{
  "title": "Thea's blog",
  "type": "blog",
  "url": "https://blog.thea.codes",
  "rss_feed": "https://blog.thea.codes/feed.xml",
  "photo_url": "https://github.com/theacodes.png",
  "language": "en",
  "authors": [
    {
      "name": "Thea Flowers",
      "social_media": [{
        "github": "theacodes",
        "twitter": "theacodes",
        "website": "https://thea.codes/",
        "mastodon": "stargirl@hachyderm.io",
        "bluesky": "theacodes.bsky.social"
      }]
    }
  ]
}
