{
  "title": "Data in life",
  "type": "blog",
  "url": "https://jhylin.github.io/Data_in_life_blog/",
  "rss_feed": "https://jhylin.github.io/Data_in_life_blog/index-python.xml",
  "photo_url": "https://github.com/jhylin/Data_in_life_blog/blob/main/profile_avatar.jpg",
  "description": "A blog using data science on pharmaceutical and healthcare data",
  "language": "en",
  "authors": [ 
    {
      "name": "Jennifer HY Lin",
      "social_media": [{
         "twitter": "@jenhylin",
         "mastodon": "@jhylin@fosstodon.org",
         "github": "jhylin"
      }]
    }
  ]
}
