{
  "title": "Katharine Jarmul",
  "type": "blog",
  "url": "https://probablyprivate.com",
  "photo_url": "https://github.com/kjam.png",
  "language": "en",
  "authors": [
    {
      "name": "Katharine Jarmul",
      "social_media": [{
        "github": "kjam",
        "mastodon": "@kjam@chaos.social"
      }]
    }
  ]
}
