{
  "title": "Reshama Shaikh",
  "type": "blog",
  "url": "https://dev.to/reshamas",
  "photo_url": "https://github.com/reshamas.png",
  "rss_feed": "https://dev.to/feed/reshamas",
  "language": "en",
  "authors": [
    {
      "name": "Reshama Shaikh",
      "social_media": [{
        "github": "reshamas"
      }]
    }
  ]
}
